[{"title": "Lorem ipsum dolor", "author": "Ram\u00f3n Opazo", "date": "16/08/2020", "tags": ["test", "blog", "formatting"], "description": "Lorem ipsum dolor sit amet, consectetur adipiscing elit. Phasellus felis nisi, ultrices sed purus feugiat, placerat viverra ligula. Interdum et malesuada fames ac ante ipsum primis in faucibus. Nunc luctus dui nisi, eget vehicula erat consequat in. Nunc in eleifend diam. Aliquam lacus mi, vestibulum sit amet ultricies in, mollis vel urna. Vestibulum odio tellus, dapibus ut diam vel, imperdiet fermentum tellus. Nunc lacinia bibendum tellus, non hendrerit ex euismod eu. Sed mattis lacus a lorem sollicitudin ornare. Phasellus urna tellus, condimentum non magna sed, tincidunt luctus orci. Aliquam at egestas diam. Donec auctor ultrices dignissim.", "image": "https://images.unsplash.com/photo-1593642702749-b7d2a804fbcf?ixlib=rb-1.2.1&ixid=eyJhcHBfaWQiOjEyMDd9&auto=format&fit=crop&w=1000&q=80", "md": "---\ntitle: Lorem ipsum dolor\nauthor: Ram\u00f3n Opazo\ndate: 16/08/2020\ntags: [test, blog, formatting]\ndescription: Lorem ipsum dolor sit amet, consectetur adipiscing elit. Phasellus felis nisi, ultrices sed purus feugiat, placerat viverra ligula. Interdum et malesuada fames ac ante ipsum primis in faucibus. Nunc luctus dui nisi, eget vehicula erat consequat in. Nunc in eleifend diam. Aliquam lacus mi, vestibulum sit amet ultricies in, mollis vel urna. Vestibulum odio tellus, dapibus ut diam vel, imperdiet fermentum tellus. Nunc lacinia bibendum tellus, non hendrerit ex euismod eu. Sed mattis lacus a lorem sollicitudin ornare. Phasellus urna tellus, condimentum non magna sed, tincidunt luctus orci. Aliquam at egestas diam. Donec auctor ultrices dignissim.\nimage: 'https://images.unsplash.com/photo-1593642702749-b7d2a804fbcf?ixlib=rb-1.2.1&ixid=eyJhcHBfaWQiOjEyMDd9&auto=format&fit=crop&w=1000&q=80'\n---\n\nLorem ipsum dolor sit amet, *consectetur* adipiscing elit. Phasellus felis nisi, ultrices sed purus feugiat, placerat viverra ligula. Interdum et malesuada fames ac ante ipsum primis in faucibus. Nunc luctus dui nisi, eget vehicula erat consequat in. Nunc in eleifend diam. Aliquam lacus mi, *vestibulum sit amet* ultricies in, mollis vel urna. Vestibulum odio tellus, dapibus ut diam vel, imperdiet fermentum tellus. Nunc lacinia bibendum tellus, non hendrerit ex euismod eu. Sed mattis lacus a lorem sollicitudin ornare. Phasellus urna tellus, condimentum non magna sed, tincidunt luctus orci. Aliquam at egestas diam. Donec auctor ultrices dignissim.\n\n```latex\nf(x) = \\int_{-\\infty}^\\infty\n    \\hat f(\\xi)\\,e^{2 \\pi i \\xi x}\n    \\,d\\xi\n```\n\n```latex\nA:m\u00d7n = \\begin{bmatrix}\na_{11} & a_{12} & \\dots & a_{1n} \\\\\na_{21} & a_{22} \\\\\n\\vdots & & \\ddots \\\\\na_{m1} & & & a_{mn} \\\\\n\\end{bmatrix}\n```\n\nhttps://github.com/RamonOpazo/AmigasVntg_AssetsRepo\n\n## Lorem ipsum & dolor\n\nPraesent mollis aliquet purus ut convallis. Maecenas nulla metus, aliquam ac mi sed, scelerisque tristique mi. Proin semper nulla nec tortor euismod placerat. Nunc consectetur nisi et metus mattis ullamcorper. Mauris massa ex, efficitur ut dictum fermentum, fermentum at nunc. Fusce maximus a velit ac imperdiet. Maecenas non nulla orci. Donec laoreet enim quis odio varius, nec malesuada sem hendrerit @amigas.vntg. Mauris iaculis ultrices massa.\n\n```latex\n\\displaystyle E_{ion} = \\frac{RT}{zF} ln \\frac{[ion]_{e}}{[ion]_{i}}\n```\n\nDuis quis dictum ex. Aliquam quis leo metus. Integer ligula erat, imperdiet quis lobortis quis, dignissim quis tellus. Vestibulum facilisis commodo nibh, nec bibendum risus dignissim vel. Cras pulvinar eleifend metus quis semper. Donec non semper eros. Nunc at magna at massa pharetra bibendum eu sed tellus.\n\n![Ut enim ad minima veniam, quis nostrum exercitationem ullam corporis suscipit laboriosam, nisi ut aliquid ex ea commodi consequatur?](https://github.com/RamonOpazo/AmigasVntg_AssetsRepo/blob/master/images/home-01.jpg?raw=true)\n\nQuisque at suscipit lacus. Quisque finibus tempor lacus a ultricies. Curabitur sodales tempor arcu vitae sodales. Proin vitae purus quis dolor pretium aliquam eu vel tortor. Phasellus cursus lorem eu dapibus tincidunt. Ut non eros vulputate, ullamcorper nunc et, fringilla augue. Cras risus ex, fringilla sit amet orci ac, vestibulum tincidunt mi.\n\n## Consectetur __adipiscing__\n\nEtiam sapien *lorem*, bibendum quis __nunc ut__, elementum mattis __*nulla*__. Fusce diam velit, tincidunt non egestas quis, pellentesque vitae urna. Quisque condimentum eros non sapien tristique, a vestibulum ligula luctus. Ut in urna vehicula, finibus orci et, bibendum metus. Aenean lobortis fringilla blandit. Suspendisse enim augue, mollis ut felis nec, tempor lobortis massa. Duis et felis facilisis justo scelerisque dignissim et ac est. Phasellus laoreet ut massa et feugiat. Sed eu sapien hendrerit, faucibus purus sed, pharetra lorem. Ut interdum sed leo a euismod. Aliquam ex lectus, vestibulum nec lacinia eget, molestie et tellus. Phasellus quis mi vitae arcu consequat euismod.\n\n-   Lorem ipsum dolor sit amet, consectetur adipiscing elit.\n    -   Fusce commodo lorem in ligula consectetur, sit amet consectetur ipsum dictum.\n-   Aliquam __convallis mauris__ quis nibh rutrum lacinia.\n    -   Donec quis nibh vel lorem ultricies condimentum.\n    -   Pellentesque eu ex sit amet leo imperdiet viverra.\n    -   Suspendisse euismod risus vel euismod faucibus.\n    -   Aliquam tempus tortor eu neque vulputate pharetra non id ipsum.\n-   Maecenas non est pretium, vulputate ligula quis, fermentum elit.\n-   Duis non dolor a magna imperdiet accumsan et ac orci.\n    -   Praesent vel magna ac mauris aliquam placerat quis vitae est.\n    -   Ut at metus convallis, tempor arcu et, imperdiet nisl.\n\n### Nam libero tempore\n\nAt vero eos et accusamus et iusto odio dignissimos ducimus qui blanditiis praesentium voluptatum deleniti atque corrupti quos dolores et quas molestias excepturi sint occaecati cupiditate non provident, similique sunt in culpa qui officia deserunt mollitia animi, id est laborum et dolorum fuga. Et harum quidem rerum facilis est et expedita distinctio. \n\n1.  Maecenas ac dui in arcu semper efficitur.\n2.  Integer non nulla vel nisl venenatis dictum.\n    -   Nunc eget orci dictum, elementum risus id, congue nulla.\n    -   Vestibulum ultrices libero quis nibh ultricies, non porttitor arcu consectetur.\n\n### Cum *soluta*\n\nNam libero tempore, cum soluta nobis est eligendi optio cumque nihil impedit quo minus id quod maxime placeat facere possimus, omnis voluptas assumenda est, omnis dolor repellendus. Temporibus autem quibusdam et aut officiis debitis aut rerum necessitatibus saepe eveniet ut et voluptates repudiandae sint et molestiae non recusandae.\n\n>   Temporibus autem quibusdam et aut officiis debitis aut rerum necessitatibus saepe eveniet ut et voluptates repudiandae sint et molestiae non recusandae.\n\nItaque earum rerum hic tenetur a sapiente delectus, ut aut reiciendis voluptatibus maiores alias consequatur aut perferendis doloribus asperiores repellat.\n\n## Finibus bonorum 1985 et malorum\n\nSuspendisse nec metus at nulla molestie consectetur. Sed semper, quam sed consequat aliquam, urna ligula vulputate lacus, ut euismod sem ex ut ante. Vestibulum condimentum magna eu dui pharetra condimentum. \n\n```javascript\nexport default {\n    name: \"Blog\",\n    components: {\n        RzContentWrapper,\n        RzIntroHero,\n        VueShowdown,\n    },\n    methods: {\n        ...mapActions(['fetchBlogs']),\n    },\n    computed: mapGetters(['allBlogs']),\n    created() {\n        this.fetchBlogs();\n    }\n}\n```\n\nPraesent eget sapien vel felis tristique accumsan quis in elit. Cras ac ligula pulvinar, condimentum ipsum sit amet, congue orci. Aenean sit amet nisl nec tortor sodales egestas non quis orci. Nulla non aliquam nunc. Donec ornare, elit vitae auctor sollicitudin, odio sem laoreet arcu, eget auctor urna felis vitae orci. Duis fringilla cursus arcu non consectetur. Phasellus et aliquet mauris. Vivamus vitae lorem faucibus, tempor quam quis, mollis arcu. Sed non sodales nulla. Suspendisse blandit volutpat diam sed gravida.\n\n| Tables   |      Are      |  Cool |\n| -------- | :-----------: | ----: |\n| col 1 is | left-aligned  | $1600 |\n| col 2 is |   centered    |   $12 |\n| col 3 is | right-aligned |    $1 |\n\nTemporibus autem quibusdam et aut officiis debitis aut rerum necessitatibus saepe eveniet ut et voluptates repudiandae sint et molestiae non recusandae.\n", "id": "30cfe684-9272-31e7-9ba6-896c696b0788"}, {"title": "Hipothalamus", "author": "Ram\u00f3n Opazo", "date": "22/07/2020", "tags": ["MCB80_3x", "neuroanatomy", "model", "subcorticalAreas"], "description": "The hipothalamus is found in all vertebrates brains, sitting below the thalamus and above the brainstem. The main function of the hipothalamus is to maintain homeostasis of the body. It achieves this goal by regulating different autonomous and behavioral systems.", "image": "https://images.unsplash.com/photo-1597424877208-91cf1b750505?ixlib=rb-1.2.1&ixid=eyJhcHBfaWQiOjEyMDd9&auto=format&fit=crop&w=1350&q=80", "md": "---\ntitle: Hipothalamus\nauthor: Ram\u00f3n Opazo\ndate: 22/07/2020\ntags: [MCB80_3x, neuroanatomy, model, subcorticalAreas]\ndescription: The hipothalamus is found in all vertebrates brains, sitting below the thalamus and above the brainstem. The main function of the hipothalamus is to maintain homeostasis of the body. It achieves this goal by regulating different autonomous and behavioral systems.\nimage: 'https://images.unsplash.com/photo-1597424877208-91cf1b750505?ixlib=rb-1.2.1&ixid=eyJhcHBfaWQiOjEyMDd9&auto=format&fit=crop&w=1350&q=80'\n---\n\nThe hipothalamus is found in all vertebrates brains, sitting below the thalamus and above the brainstem. The main function of the hipothalamus is to **maintain homeostasis** of the body. It achieves this goal by regulating different autonomous and behavioral systems.\n\nWhenever there is an homeostatic unbalance, the hipothalamus mounts a **three\u2013pronged response**: engagement of the _autonomic nervous system (ANS)_, the _endocrine system_, and the _behavioral system_. This response has the aim to rebalance the body to an internal _set point_.\n\nCommands are then sent to: _a)_ the brainstem and the spinal cord to activate the autonomic preganglionic neurons to mount a _flight or fight_, or _rest and digest_ response; _b)_ the basal ganglia and the cortex, in order to motivate homeostatic behavior; and finally _c)_ the pituitary gland, which in turn control hormone release.\n\n## Zettel\n\nIn this fashion, the hipothalamus generate hunger, thirst, cold, heat, etc. It even generate the drive for sex, parenting aspects and attachment. Due to the fact that many small hypothalamic nuclei control all this factors, when deregulation in one nuclei happens it\u2019s hard to target and isolate it. In general, hypothalamic intervention produce deregulation of other healthy hypothalamic nuclei (i.e. off\u2013target effects).\n\n## Links\n\n- [Wikipedia \u00bb Hypothalamus](https://en.wikipedia.org/wiki/Hypothalamus)\n", "id": "0079f6d3-0410-3f17-945f-6b89e9f63014"}, {"title": "Hippocampus", "author": "Ram\u00f3n Opazo", "date": "21/07/2020", "tags": ["MCB80_3x", "model", "subcorticalAreas"], "description": "There are two types of long term memories. Declarative memory, also named explicit memory, is the memory of knowing what, that is, facts and events, consciously recalled (or declared). It is explicitly stored and retrieved.", "image": "https://images.unsplash.com/photo-1595313173023-1b317fc8348d?ixlib=rb-1.2.1&ixid=eyJhcHBfaWQiOjEyMDd9&auto=format&fit=crop&w=611&q=80", "md": "---\ntitle: Hippocampus\nauthor: Ram\u00f3n Opazo\ndate: 21/07/2020\ntags: [MCB80_3x, model, subcorticalAreas]\ndescription: There are two types of long term memories. Declarative memory, also named explicit memory, is the memory of knowing what, that is, facts and events, consciously recalled (or declared). It is explicitly stored and retrieved.\nimage: 'https://images.unsplash.com/photo-1595313173023-1b317fc8348d?ixlib=rb-1.2.1&ixid=eyJhcHBfaWQiOjEyMDd9&auto=format&fit=crop&w=611&q=80'\n---\n\nThere are two types of long term memories. **Declarative memory**, also named _explicit memory_, is the memory of **knowing what**, that is, facts and events, _consciously recalled_ (or declared). It is explicitly stored and retrieved.\n\n**Procedural memory**, also called _implicit memory_, is the memory of **knowing how**. It is an _unconscious memory_ of skills and how to do things, particularly in the use of objects or movements of the body. They are acquired by repetition and practice.\n\nThe **hippocampus** is a subcortical area that has two major functions: declarative memory encoding and spatial orientation. Damage in the hippocampus produce _anterograde amnesia_, but implicit procedural memory is preserved, though it must be introduced every time by an external examiner. Long\u2013term potentiation [\u00a7202006241050 \u2500 LTP in depth] has been involved in this phenomenon, enforcing neural patterns that encode for declarative memory.\n\nAbout the spatial orientation function, cells of the hippocampus and the neighboring _entorhinal cortex_ constitute a kind of _positioning system_ that dynamically maps the environment as one moves around from place to place.\n\nThe hippocampus is one of the two places where **neurogenesis** happens in the _adult brain_. Its role is not well understood, it is apparently linked to _memory overwrite_, a process that happens preferentially in babies, who don\u2019t form declarative memories for the first two years.\n\n## Zettel\n\n- \u00a7202007221805 \u2500 Hipothalamus\n\n## Links\n\n- [The Human Memory \u00bb Declarative (explicit) & procedural (implicit) memory](https://human-memory.net/explicit-implicit-memory/)\n- [Wikipedia \u00bb Hippocampus](https://en.wikipedia.org/wiki/Hippocampus)\n", "id": "deeec72e-a257-353b-b2b0-cc03a3e756fb"}, {"title": "Limbic system", "author": "Ram\u00f3n Opazo", "date": "21/07/2020", "tags": ["MCB80_3x", "neuroanatomy", "model", "subcorticalAreas"], "description": "Evolutionary classification of the brain is useful to understand part of the functions of each structure.", "image": "https://images.unsplash.com/photo-1518548305430-5241c13e9864?ixlib=rb-1.2.1&ixid=eyJhcHBfaWQiOjEyMDd9&auto=format&fit=crop&w=1350&q=80", "md": "---\ntitle: Limbic system\nauthor: Ram\u00f3n Opazo\ndate: 21/07/2020\ntags: [MCB80_3x, neuroanatomy, model, subcorticalAreas]\ndescription: Evolutionary classification of the brain is useful to understand part of the functions of each structure.\nimage: 'https://images.unsplash.com/photo-1518548305430-5241c13e9864?ixlib=rb-1.2.1&ixid=eyJhcHBfaWQiOjEyMDd9&auto=format&fit=crop&w=1350&q=80'\n---\n\nEvolutionary classification of the brain is useful to understand part of the functions of each structure:\n\n1. **Protoreptilian brain**.\n    - Basal ganglia.\n    - Midbrain.\n    - Brainstem\n2. **Paleomammalian brain**.\n    - Limbic system.\n3. **Neomammalian brain**.\n    - Cerebral cortex.\n\nThe limbic system is _composed of_: the olfactory bulbs, hippocampus, amygdala, anterior thalamic nuclei, fornix, septum, habenula, cingulate gyrus, limbic cortex and mid brain areas.\n\nThe main function of this system is to create _emotional_ and _motivational_ experiences of the world. It does so controlling feelings like fear, pleasure and adrenaline. The second function of the limbic system is in the _formation of memories_, in particular when they have emotional significance.\n\nThe **amygdala** is involved in _emotionally significant memories_. Though is not only reserved for negative experiences (it in fact encodes positively charged memories), negative associations are learned faster and are easy to recall. Input signals to the amygdala come from sensory receptors and the sensory areas of the cortex. In the case of olfactory sensory information, this arrives directly from the olfactory bulb and the cortex.\n\n# Zettel\n\n- \u00a7202007221634 \u2500 Hippocampus\n\n# Links\n\n- [Wikipedia \u00bb Limbic_system](https://en.wikipedia.org/wiki/Limbic_system)\n- [Wikipedia \u00bb Amygdala](https://en.wikipedia.org/wiki/Amygdala)", "id": "be4ed43c-8234-3624-b62a-ed84b4ea9d20"}, {"title": "Thalamus", "author": "Ram\u00f3n Opazo", "date": "21/07/2020", "tags": ["MCB80_3x", "neuroanatomy", "model", "subcorticalAreas"], "description": "The thalamus is the largest part of the diencephalon, sitting at the center of the brain, between the cerebral cortex and the midbrain. It receives input from all the sensory receptors except the olfactory system, and also from almost all areas of the cerebral cortex either sensory and nonsensory, the basal ganglia, the cerebellum and the limbic system. It also projects back to the cortex and subcortical structures in reciprocal loops. For these, the thalamus is a relay station but also a place where processing occurs. The main functions of the thalamus are.", "image": "https://images.unsplash.com/photo-1597801911523-679070fc203f?ixlib=rb-1.2.1&ixid=eyJhcHBfaWQiOjEyMDd9&auto=format&fit=crop&w=658&q=80", "md": "---\ntitle: Thalamus\nauthor: Ram\u00f3n Opazo\ndate: 21/07/2020\ntags: [MCB80_3x, neuroanatomy, model, subcorticalAreas]\ndescription: The thalamus is the largest part of the diencephalon, sitting at the center of the brain, between the cerebral cortex and the midbrain. It receives input from all the sensory receptors except the olfactory system, and also from almost all areas of the cerebral cortex either sensory and nonsensory, the basal ganglia, the cerebellum and the limbic system. It also projects back to the cortex and subcortical structures in reciprocal loops. For these, the thalamus is a relay station but also a place where processing occurs. The main functions of the thalamus are.\nimage: 'https://images.unsplash.com/photo-1597801911523-679070fc203f?ixlib=rb-1.2.1&ixid=eyJhcHBfaWQiOjEyMDd9&auto=format&fit=crop&w=658&q=80'\n---\n\nThe **thalamus** is the largest part of the diencephalon, sitting at the center of the brain, between the cerebral cortex and the midbrain. It receives input from all the sensory receptors _except_ the olfactory system, and also from almost all areas of the cerebral cortex either sensory and nonsensory, the basal ganglia, the cerebellum and the limbic system. It also projects back to the cortex and subcortical structures in _reciprocal loops_. For these, the thalamus is a _relay station_ but also a place where processing occurs. The main functions of the thalamus are:\n\n1. **Relay station**. There are two pathways, downwards from the cerebral cortex, and upwards towards it. Visual information pass through the LGN, whereas auditory information does through the MGN.\n2. **Sensory processing**. Sensory signals get modified and then projected to the specific area of the cerebral cortex they belong.\n3. **State regulation**. Arousal, or level of awareness, is involved with thalamic process, though still not well understood.\n\nDamage to the thalamus produce a deregulation of awareness level. Loss of function conduce to coma. A thalamic disease named **fatal familial insomnia** produces progressive lethal insomnia due to selective degeneration of thalamic neurons.\n\n# Zettel\n\n- \u00a7202007221304 \u2500 Limbic system\n\n# Links\n\n- [Wikipedia \u00bb Thalamus](https://en.wikipedia.org/wiki/Thalamus)", "id": "4067c212-f7eb-3e12-8d6d-969e5a1e3b77"}, {"title": "Basal ganglia", "author": "Ram\u00f3n Opazo", "date": "21/07/2020", "tags": ["MCB80_3x", "neuroanatomy", "model", "subcorticalAreas"], "description": "The forebrain, also named prosencephalon, encompasses four main functional systems, that is, the cerebral cortex, the basal ganglia, the thalamus and the limbic system.", "image": "https://images.unsplash.com/photo-1597806773501-d76c5333c0d5?ixlib=rb-1.2.1&ixid=eyJhcHBfaWQiOjEyMDd9&auto=format&fit=crop&w=1351&q=80", "md": "---\ntitle: Basal ganglia\nauthor: Ram\u00f3n Opazo\ndate: 21/07/2020\ntags: [MCB80_3x, neuroanatomy, model, subcorticalAreas]\ndescription: The forebrain, also named prosencephalon, encompasses four main functional systems, that is, the cerebral cortex, the basal ganglia, the thalamus and the limbic system.\nimage: 'https://images.unsplash.com/photo-1597806773501-d76c5333c0d5?ixlib=rb-1.2.1&ixid=eyJhcHBfaWQiOjEyMDd9&auto=format&fit=crop&w=1351&q=80'\n---\n\nThe **forebrain**, also named prosencephalon, encompasses four main functional systems: the cerebral cortex, the basal ganglia, the thalamus and the limbic system.\n\nThe **basal ganglia** interconnects between the neocortex, brainstem, thalamus and other brain areas. Its main function is related to voluntary movement and execution of habitual or automatic actions, as well as emotional and cognitive functions.\n\nOnce voluntary movement is generated, the signal gets modulated cognitively by the cortex, projecting down to lower motor neurons. The basal ganglia contributes to modulation unconsciously, thus, it _does not_ initiate voluntary movement.\n\nThere are two pathways for basal ganglia modulation, which are necessary in _conjunction_ to have the desired effect:\n\n1. The **direct pathway** send _excitatory_ signals to the cortex through excitation of the thalamus. This produces _increased motor activity_.\n2. The **indirect pathway** send _inhibitory_ signals to the thalamus, preventing excitation of the cortex. The net effect is a _decreased motor activity_.\n\nIt\u2019s possible that the direct pathway excites motor programms that are _adaptive_ to the task at hand, whereas the indirect pathway suppress the execution of _competing_ programms. Two disease models explain the deregulation of either pathway:\n\n1. In **Parkinson\u2019s disease** there is a loss of the dopaminergic cells of the **substantia nigra**. Dopamine is used to excite the direct pathway and inhibit the indirect one, thus, in Parkinson\u2019s disease there is an increased activity of the _inhibitory indirect pathway_. The symptoms are difficulty to initiate movement and resting tremor.\n2. In **Huntington\u2019s disease** there is a selective loss of cells of the **striatum**. There are two types of neurons in the striatum specific for either pathway. In Huntington\u2019s disease the selective loss affects only those neurons involved in the indirect pathway, tipping the balance towards the _excitatory direct pathway_. The symptoms include choreaform movements.\n\n# Zettel\n\n- \u00a7202007221249 \u2500 Thalamus\n\n# Links\n\n- [Wikipedia \u00bb Basal ganglia](https://en.wikipedia.org/wiki/Basal_ganglia)", "id": "94c283e9-e3aa-38a7-81b9-8a39de49d0c4"}, {"title": "Nernst equation", "author": "Ram\u00f3n Opazo", "date": "04/06/2020", "tags": ["MCB80_1x", "neurophysiology", "neuroscience", "membranePotential", "equation"], "description": "The Nernst equation allows for the calculation of the net membrane potential given the relative concentration of a given ion on each side of the cell's membrane. When calculating the potential on an equilibrium state between diffusion and electrostatic forces on a single ion species we solve for the Nernst potential, and is denoted with the ion subscript.", "image": "https://images.unsplash.com/photo-1597816196853-9d15dfd9bb06?ixlib=rb-1.2.1&ixid=eyJhcHBfaWQiOjEyMDd9&auto=format&fit=crop&w=1948&q=80", "md": "---\ntitle: Nernst equation\nauthor: Ram\u00f3n Opazo\ndate: 04/06/2020\ntags: [MCB80_1x, neurophysiology, neuroscience, membranePotential, equation]\ndescription: The Nernst equation allows for the calculation of the net membrane potential given the relative concentration of a given ion on each side of the cell's membrane. When calculating the potential on an equilibrium state between diffusion and electrostatic forces on a single ion species we solve for the Nernst potential, and is denoted with the ion subscript.\nimage: 'https://images.unsplash.com/photo-1597816196853-9d15dfd9bb06?ixlib=rb-1.2.1&ixid=eyJhcHBfaWQiOjEyMDd9&auto=format&fit=crop&w=1948&q=80'\n---\n\nThe Nernst equation allows for the calculation of the net membrane potential given the _relative_ concentration of a given ion on each side of the cell's membrane. When calculating the potential on an equilibrium state between diffusion and electrostatic forces on a single ion species we solve for the **Nernst potential**, and is denoted with the ion subscript.\n\n```latex\n\\displaystyle E_{ion} = \\frac{RT}{zF} ln \\frac{[ion]_{e}}{[ion]_{i}}\n```\n\n> for $T$ in Kelvin, $R = 8.314\\ J/K*mol$ (universal gas constant), $F = 96,485\\ C/mol$ (Faraday's constant), $ln$: natural log, base $e$ $(\\sim 2.718)$, $C$: coulomb, $[ion]_{e}$ corresponds to the extracellular concentration of an ion, $[ion]_{i}$ thus to the intracellular concentration, and $z$: valence of the ion (in this cases can be approximated to the net charge of the ion, e.g. $+1$ in the case of $K^{+}$, or $+2$ in the case of $Ca^{+2}$).\n\nDue to the fact that the Nernst potential is reached when the system is at equilibrium, it is also known as **equilibrium potential**. On a neuron, typically the **resting potential** (the membrane potential of the cell at rest) is about the same as the Nernst potential of $K^{+}$. Nevertheless, the resting potential is the result of the composite of the flow of multiple ions through channels plus the participation of ion pumps, whereas the Nernst potential only involves the equilibrium of a given ion.\n\nFinally, the point at which the flux of ions reverse direction is called the **reversal potential**, and is usually used when talking about ion channels.\n\n# Zettel\n\n- \u00a7202006042106 \u2500 Cellular membrane driving force\n- \u00a7202006052003 \u2500 Goldman\u2013Hodgkin\u2013Katz flux equation\n\n# Links\n\n- [Wikipedia \u00bb Nernst equation](https://en.wikipedia.org/wiki/Nernst_equation)\n- [GitLab \u00bb Markdown guide](https://about.gitlab.com/handbook/markdown-guide/)\n- [List of LaTeX mathematical symbols](https://oeis.org/wiki/List_of_LaTeX_mathematical_symbols)", "id": "c2fe5948-6c49-39b6-bac3-1f9f55a3a5d0"}]